{
  "schema_version": 1,
  "machine_id": "B",
  "os": "windows",
  "checked_at": "2026-08-11T09:34:49Z",
  "profile": "light",
  "config_valid": true,
  "capabilities": {
    "dialog_development": true,
    "snapshot_export": false,
    "mod_execution": false,
    "static_validation": true,
    "load_test": false
  },
  "snapshot": {
    "status": "missing",
    "game_version": null,
    "fingerprint": null
  },
  "warnings": []
}
