{
  "schema_version": 1,
  "machine_id": "A",
  "os": "windows",
  "checked_at": "2026-08-12T14:50:41Z",
  "profile": "partial",
  "config_valid": true,
  "capabilities": {
    "dialog_development": true,
    "snapshot_export": true,
    "mod_execution": false,
    "static_validation": true,
    "load_test": false
  },
  "snapshot": {
    "status": "stale",
    "game_version": "Operation Postern v1.19.2.0.a729 (d245)",
    "fingerprint": "ba683a184d14e58d6df9e1636d372a2771b558edd9a77baa7c13de9521888b8f"
  },
  "warnings": [
    "本体 state/state_category 指纹或快照 schema 已变化：依赖快照的执行与测试必须阻断，直至显式刷新"
  ]
}
